<?xml version="1.0" encoding="UTF-8"?>
<tns:FunctionalTest xmlns:tns="http://www.example.org/configurationValidator" xmlns:xsi="http://www.w3.org/2001/XMLSchema-instance" xsi:schemaLocation="http://www.example.org/configurationValidator ../model/configurationValidator.xsd ">
  <tns:Configuration><tns:Include
  		configuration-file="Portlet_Wiki_WikiNodeService.xml" /><tns:Include
  		configuration-file="Portal_UserService.xml" ></tns:Include><tns:Include
  		configuration-file="Portal_GroupService.xml" /><tns:Include
  		configuration-file="Portlet_Wiki_WikiPageService.xml" />
  </tns:Configuration>
  <tns:Workloads><!--Recupera le info di autenticazione-->
  	<tns:Workload name="getCredentials">
  		<tns:Choreography>
  			<tns:Call portlet="Portal_UserService" method="getUserById/1">
  				<tns:Parameters>
  					<tns:Parameter name="userId" variable="userId"></tns:Parameter></tns:Parameters>
  				<tns:Results>
  					<tns:StoreResult variable="companyId" name="companyId" /></tns:Results></tns:Call>
  			<tns:Call portlet="Portal_GroupService" method="getUserGroup/1">
  				<tns:Parameters>
  					<tns:Parameter name="companyId" variable="companyId"></tns:Parameter>
  					<tns:Parameter name="userId" variable="userId"></tns:Parameter></tns:Parameters>
  				<tns:Results>
  					<tns:StoreResult variable="groupId" name="groupId" /></tns:Results></tns:Call>
  		</tns:Choreography>
  	</tns:Workload>
  	<tns:Workload name="addNode">
  		<tns:Choreography>
  			<tns:Call portlet="Portlet_Wiki_WikiNodeService" method="addNode/1">
  				<tns:Parameters>
  					<tns:Parameter name="groupId" variable="groupId"></tns:Parameter>
  					<tns:Parameter name="name" variable="nameWikiNode"></tns:Parameter>
  					<tns:Parameter name="description">descrizione del nodo di prova</tns:Parameter></tns:Parameters>
  				<tns:Results>
  					<tns:StoreResult variable="nodeId" name="nodeId" /></tns:Results>
  			</tns:Call>
  		</tns:Choreography>
  	</tns:Workload>
  	<tns:Workload name="addPage">
  		<tns:Choreography>
  			<tns:Call portlet="Portlet_Wiki_WikiNodeService" method="getNode/2">
  				<tns:Parameters>
  					<tns:Parameter name="groupId" variable="groupId"></tns:Parameter>
  					<tns:Parameter name="name" variable="nameWikiNode"></tns:Parameter></tns:Parameters>
  				<tns:Results>
  					<tns:StoreResult variable="nodeId" name="nodeId" /></tns:Results>
  			</tns:Call>
  			<tns:Call portlet="Portlet_Wiki_WikiPageService" method="addPage/1">
  				<tns:Parameters>
  					<tns:Parameter name="nodeId" variable="nodeId">
  					</tns:Parameter>
  					<tns:Parameter name="title">
  						title Wiki
  					</tns:Parameter>
  					<tns:Parameter name="content">
  						content Wiki
  					</tns:Parameter>
  					<tns:Parameter name="summary">
  						summary Wiki
  					</tns:Parameter>
  				</tns:Parameters>
  			</tns:Call>
  		</tns:Choreography>
  	</tns:Workload>
  </tns:Workloads>
  <tns:Run>
  	<tns:Declarations>
  		<tns:Declare name="userId">184801</tns:Declare>
  		<tns:Declare name="companyId"></tns:Declare>
  		<tns:Declare name="groupId"></tns:Declare>
  		<tns:Declare name="nodeId"></tns:Declare>
  		<tns:Declare name="nameWikiNode">nodo di prova</tns:Declare></tns:Declarations>
  	<tns:WorkloadReference name="getCredentials" ></tns:WorkloadReference><tns:WorkloadReference
  		name="addPage" /></tns:Run>
</tns:FunctionalTest>
