<?xml version="1.0" encoding="UTF-8"?>
<tns:FunctionalTest xmlns:tns="http://www.example.org/configurationValidator" xmlns:xsi="http://www.w3.org/2001/XMLSchema-instance" xsi:schemaLocation="http://www.example.org/configurationValidator ../model/configurationValidator.xsd ">
  <tns:Configuration><tns:Include
  		configuration-file="Portal_UserService.xml" />
  </tns:Configuration>
  <tns:Workloads>
  	<tns:Workload name="getCredentials">
  		<tns:Choreography>
  			<tns:Call portlet="Portal_UserService" method="getUserById/1">
  				<tns:Parameters>
  					<tns:Parameter name="userId" variable="userId"></tns:Parameter></tns:Parameters>
  				<tns:Results>
  					<tns:StoreResult variable="companyId" name="companyId" /></tns:Results></tns:Call>
  			<tns:Call portlet="Portal_GroupService" method="getUserGroup/1">
  				<tns:Parameters>
  					<tns:Parameter name="companyId" variable="companyId"></tns:Parameter>
  					<tns:Parameter name="userId" variable="userId"></tns:Parameter></tns:Parameters>
  				<tns:Results>
  					<tns:StoreResult variable="groupId" name="groupId" /></tns:Results></tns:Call>
  		</tns:Choreography>
  	</tns:Workload>
  	<tns:Workload name="modifyUser">
  	
  		<tns:Choreography>
  			<tns:Call portlet="Portal_UserService" method="updatePassword/1">
  				<tns:Parameters>
  					<tns:Parameter name="password">provanuovaPassword</tns:Parameter>
  					<tns:Parameter name="userId" variable="userId"></tns:Parameter></tns:Parameters>
  			</tns:Call> 
  			  <tns:Call portlet="Portal_UserService" method="updateScreenName/1">
  				<tns:Parameters>
  					<tns:Parameter name="screenName">nuovohhhhhhhScreenName</tns:Parameter>
  					<tns:Parameter name="userId" variable="userId"></tns:Parameter></tns:Parameters>
  			</tns:Call>
  					
  			<tns:Call portlet="Portal_UserService" method="addOrganizationUsers/1">
  				<tns:Parameters>
  					<tns:Parameter name="organizationId"
  						variable="186627"></tns:Parameter>
  					<tns:Parameter name="userId" variable="userId"></tns:Parameter></tns:Parameters></tns:Call>
  		</tns:Choreography>
  	</tns:Workload>
  	
  </tns:Workloads>
  <tns:Run>
  	<tns:Declarations>
  		<tns:Declare name="companyId"></tns:Declare>
  		<tns:Declare name="userId"></tns:Declare>
	</tns:Declarations>
  	<tns:WorkloadReference name="modifyUser" ></tns:WorkloadReference></tns:Run>
</tns:FunctionalTest>
