<?xml version="1.0" encoding="UTF-8"?>
<tns:FunctionalTest xmlns:tns="http://www.example.org/configurationValidator" xmlns:xsi="http://www.w3.org/2001/XMLSchema-instance" xsi:schemaLocation="http://www.example.org/configurationValidator ../model/configurationValidator.xsd ">
  <tns:Configuration><tns:Include
  		configuration-file="Portal_UserService.xml" ></tns:Include><tns:Include
  		configuration-file="Portal_GroupService.xml" /><tns:Include
  		configuration-file="Portlet_MB_MBCategoryService.xml" />
  </tns:Configuration>
  <tns:Workloads><!--Recupera le info di autenticazione-->
  	<tns:Workload name="getCredentials">
  		<tns:Choreography>
  			<tns:Call portlet="Portal_UserService" method="getUserById/1">
  				<tns:Parameters>
  					<tns:Parameter name="userId" variable="userId"></tns:Parameter></tns:Parameters>
  				<tns:Results>
  					<tns:StoreResult variable="companyId" name="companyId" /></tns:Results></tns:Call>
  			<tns:Call portlet="Portal_GroupService" method="getUserGroup/1">
  				<tns:Parameters>
  					<tns:Parameter name="companyId" variable="companyId"></tns:Parameter>
  					<tns:Parameter name="userId" variable="userId"></tns:Parameter></tns:Parameters>
  				<tns:Results>
  					<tns:StoreResult variable="groupId" name="groupId" /></tns:Results></tns:Call>
  		</tns:Choreography>
  	</tns:Workload><!--Aggiungo una categoria - creo una sottocategoria-->
  	<tns:Workload name="addCategory">
  		<tns:Choreography>
  			<tns:Call portlet="Portlet_MB_MBCategoryService" method="addCategory/1">
  				<tns:Parameters>
  					<tns:Parameter name="catName" variable="catName"></tns:Parameter>
  					<tns:Parameter name="catDescr" variable="catDescr"></tns:Parameter>
  					<tns:Parameter name="groupId" variable="groupId"></tns:Parameter>
  					<tns:Parameter name="parentCategoryId">0</tns:Parameter>
  					<tns:Parameter name="keyattr">chiave attributo della categoria</tns:Parameter>
  					<tns:Parameter name="valattr">valore di attributo della categoria</tns:Parameter></tns:Parameters>
  				<tns:Results>
  					<tns:StoreResult variable="categoryId" name="categoryId" ></tns:StoreResult>
  				</tns:Results>
  			</tns:Call>
 			<tns:Call portlet="Portlet_MB_MBCategoryService" method="addCategory/1">
  				<tns:Parameters>
  					<tns:Parameter name="catName">sottoCategoria</tns:Parameter>
  					<tns:Parameter name="catDescr">sono una sottocategoria</tns:Parameter>
  					<tns:Parameter name="groupId" variable="groupId"></tns:Parameter>
  					<tns:Parameter name="parentCategoryId" variable="categoryId"></tns:Parameter>
  					<tns:Parameter name="keyattr">chiave attributo della sottocategoria</tns:Parameter>
  					<tns:Parameter name="valattr">valore di attributo della sottocategoria</tns:Parameter>
  				</tns:Parameters>
  			</tns:Call>  			
  		</tns:Choreography>
  	</tns:Workload>
  </tns:Workloads>
  <tns:Run>
  	<tns:Declarations>
  		<tns:Declare name="userId">184801</tns:Declare>
  		<tns:Declare name="companyId"></tns:Declare>
  		<tns:Declare name="groupId"></tns:Declare>
  		<tns:Declare name="catName">categoria di prova</tns:Declare>
  		<tns:Declare name="catDescr">descrizione di una categoria di prova</tns:Declare>
  		<tns:Declare name="categoryId"></tns:Declare></tns:Declarations>
  	<tns:WorkloadReference name="getCredentials" ></tns:WorkloadReference><tns:WorkloadReference name="addCategory" ></tns:WorkloadReference>
  	</tns:Run>
</tns:FunctionalTest>
