<?xml version="1.0" encoding="UTF-8"?>
<tns:FunctionalTest xmlns:tns="http://www.example.org/configurationValidator"
	xmlns:xsi="http://www.w3.org/2001/XMLSchema-instance"
	xsi:schemaLocation="http://www.example.org/configurationValidator ../model/configurationValidator.xsd ">
	<tns:Configuration>
		<tns:Include configuration-file="Portlet_Asset_AssetTagService.xml" />
		<tns:Include configuration-file="Portal_UserService.xml" />
		<tns:Include configuration-file="Portal_GroupService.xml" />
	</tns:Configuration>
	<tns:Workloads><!--Recupera le info di autenticazione-->
	<tns:Workload name="getCredentials">
  		<tns:Choreography>
  			<tns:Call portlet="Portal_UserService" method="getUserById/1">
  				<tns:Parameters>
  					<tns:Parameter name="userId" variable="userId"></tns:Parameter></tns:Parameters>
  				<tns:Results>
  					<tns:StoreResult variable="companyId" name="companyId" /></tns:Results></tns:Call>
  			<tns:Call portlet="Portal_GroupService" method="getUserGroup/1">
  				<tns:Parameters>
  					<tns:Parameter name="companyId" variable="companyId"></tns:Parameter>
  					<tns:Parameter name="userId" variable="userId"></tns:Parameter></tns:Parameters>
  				<tns:Results>
  					<tns:StoreResult variable="groupId" name="groupId" /></tns:Results></tns:Call>
  		</tns:Choreography>
  		</tns:Workload><!--Recupera i tags-->
	<tns:Workload name="getTags">
		<tns:Choreography>
			<tns:Call portlet="Portlet_Asset_AssetTagService" method="getGroupsTags/1">
				<tns:Parameters>
					<tns:Parameter name="groupId" variable="groupId"></tns:Parameter></tns:Parameters>
				<tns:Results>
					<tns:StoreResult variable="tagId" name="tagId" /></tns:Results></tns:Call>
		</tns:Choreography>
	</tns:Workload><!--Aggiungo un tag-->
	<tns:Workload name="AddNewTag">
		<tns:Choreography>
			<tns:Call portlet="Portlet_Asset_AssetTagService" method="addTag/1">
				<tns:Parameters>
					<tns:Parameter name="nameTag">tag2Prova</tns:Parameter>
					<tns:Parameter name="groupId" variable="groupId">
					</tns:Parameter></tns:Parameters>
				<tns:Results>
					<tns:StoreResult variable="tagId" name="tagId" /></tns:Results></tns:Call>
		</tns:Choreography>
	</tns:Workload>
	</tns:Workloads>
	<tns:Run >
		<tns:Declarations>
			<tns:Declare name="userId">184801</tns:Declare>
			<tns:Declare name="groupId"></tns:Declare>
			<tns:Declare name="companyId"></tns:Declare>
			<tns:Declare name="eventId"></tns:Declare>
			<tns:Declare name="tagId"></tns:Declare></tns:Declarations>
		<tns:WorkloadReference name="getCredentials" /><tns:WorkloadReference
			name="AddNewTag" /></tns:Run>
</tns:FunctionalTest>
