<?xml version="1.0" encoding="UTF-8"?>
<tns:FunctionalTest xmlns:tns="http://www.example.org/configurationValidator" xmlns:xsi="http://www.w3.org/2001/XMLSchema-instance" xsi:schemaLocation="http://www.example.org/configurationValidator ../model/configurationValidator.xsd ">
  <tns:Configuration><tns:Include
  		configuration-file="Portal_UserService.xml" ></tns:Include><tns:Include
  		configuration-file="Portal_GroupService.xml" /><tns:Include
  		configuration-file="Portlet_Polls_PollsQuestionService.xml" />
  </tns:Configuration>
  <tns:Workloads><!--Recupera le info di autenticazione-->
  	<tns:Workload name="getCredentials">
  		<tns:Choreography>
  			<tns:Call portlet="Portal_UserService" method="getUserById/1">
  				<tns:Parameters>
  					<tns:Parameter name="userId" variable="userId"></tns:Parameter></tns:Parameters>
  				<tns:Results>
  					<tns:StoreResult variable="companyId" name="companyId" /></tns:Results></tns:Call>
  			<tns:Call portlet="Portal_GroupService" method="getUserGroup/1">
  				<tns:Parameters>
  					<tns:Parameter name="companyId" variable="companyId"></tns:Parameter>
  					<tns:Parameter name="userId" variable="userId"></tns:Parameter></tns:Parameters>
  				<tns:Results>
  					<tns:StoreResult variable="groupId" name="groupId" /></tns:Results></tns:Call>
  		</tns:Choreography>
  	</tns:Workload><!--Aggiunge un Poll-->
  	<tns:Workload name="newPoll">
  		<tns:Choreography>
  			<tns:Call portlet="Portlet_Polls_PollsQuestionService" method="addQuestion/1">
  				<tns:Parameters>
  					<tns:Parameter name="titleMapLanguageId1">titoloEsempioLang</tns:Parameter>
  					<tns:Parameter name="titleMapValues1">titoloValueEsempio</tns:Parameter>
  					<tns:Parameter name="descriptionMapLanguageIds1">descriptionEsempioLan</tns:Parameter>
  					<tns:Parameter name="descriptionMapValues">descriptionValueEsempio</tns:Parameter>
  					<tns:Parameter name="groupId" variable="groupId"></tns:Parameter></tns:Parameters>
  			</tns:Call>  			
  		</tns:Choreography>
  	</tns:Workload>
  </tns:Workloads>
  <tns:Run>
  	<tns:Declarations>
  		<tns:Declare name="userId">10196</tns:Declare>
  		<tns:Declare name="companyId"></tns:Declare>
  		<tns:Declare name="groupId"></tns:Declare></tns:Declarations>

  	<tns:WorkloadReference name="getCredentials" ></tns:WorkloadReference>
	<tns:WorkloadReference name="newPoll" ></tns:WorkloadReference>
  	</tns:Run>
</tns:FunctionalTest>
