<?xml version="1.0" encoding="UTF-8"?>
<tns:FunctionalTest xmlns:tns="http://www.example.org/configurationValidator"
	xmlns:xsi="http://www.w3.org/2001/XMLSchema-instance"
	xsi:schemaLocation="http://www.example.org/configurationValidator ../model/configurationValidator.xsd ">
	<tns:Configuration>
		<tns:Include configuration-file="Portlet_Cal_CalEventService.xml" />
		<tns:Include configuration-file="Portal_UserService.xml" />
		<tns:Include configuration-file="Portal_GroupService.xml" />
	</tns:Configuration>
	<tns:Workloads><!--Recupera le info di autenticazione-->
	<tns:Workload name="getCredentials">
  		<tns:Choreography>
  			<tns:Call portlet="Portal_UserService" method="getUserById/1">
  				<tns:Parameters>
  					<tns:Parameter name="userId" variable="userId"></tns:Parameter></tns:Parameters>
  				<tns:Results>
  					<tns:StoreResult variable="companyId" name="companyId" /></tns:Results></tns:Call>
  			<tns:Call portlet="Portal_GroupService" method="getUserGroup/1">
  				<tns:Parameters>
  					<tns:Parameter name="companyId" variable="companyId"></tns:Parameter>
  					<tns:Parameter name="userId" variable="userId"></tns:Parameter></tns:Parameters>
  				<tns:Results>
  					<tns:StoreResult variable="groupId" name="groupId" /></tns:Results></tns:Call>
  		</tns:Choreography>
  		</tns:Workload><!--Inserisce un evento in calendario (preceduto da getCredentials)-->
	<tns:Workload name="addEventInCalendar">
		<tns:Choreography>
			<tns:Call portlet="Portlet_Cal_CalEventService" method="getEvents/1">
				<tns:Parameters>
					<tns:Parameter name="groupId" variable="groupId"></tns:Parameter>
					<tns:Parameter name="start">0</tns:Parameter>
					<tns:Parameter name="end">1392021312</tns:Parameter>
				</tns:Parameters>
			</tns:Call>
			<tns:Call portlet="Portlet_Cal_CalEventService" method="addEvent/1">
				<tns:Parameters>
					<tns:Parameter name="title">titoloEvento</tns:Parameter>
					<tns:Parameter name="description">descrizione evento</tns:Parameter>
					<tns:Parameter name="startDateMonth">10</tns:Parameter>
					<tns:Parameter name="startDateDay">10</tns:Parameter>
					<tns:Parameter name="startDateYear">2013</tns:Parameter>
					<tns:Parameter name="endDateMonth">10</tns:Parameter>
					<tns:Parameter name="endDateDay">10</tns:Parameter>
					<tns:Parameter name="endDateYear">2014</tns:Parameter>
					<tns:Parameter name="groupId" variable="groupId"></tns:Parameter></tns:Parameters>
				<tns:Results>
					<tns:StoreResult variable="eventId" name="eventId" /></tns:Results></tns:Call>
					
		</tns:Choreography>
	</tns:Workload><!--Elimina un evento in calendario (preceduto da getCredentials)-->
	<tns:Workload name="removeEventInCalendar">
		<tns:Choreography>
			<tns:Call portlet="Portlet_Cal_CalEventService" method="getEvents/1">
				<tns:Parameters>
					<tns:Parameter name="groupId" variable="groupId"></tns:Parameter>
					<tns:Parameter name="start">0</tns:Parameter>
					<tns:Parameter name="end">1</tns:Parameter></tns:Parameters>
				<tns:Results>
					<tns:StoreResult variable="eventId" name="eventId" /></tns:Results></tns:Call>
			<tns:Call portlet="Portlet_Cal_CalEventService" method="deleteEvent/1">
				<tns:Parameters>
					<tns:Parameter name="eventId" variable="eventId"></tns:Parameter></tns:Parameters></tns:Call>
		</tns:Choreography>
	</tns:Workload>
	</tns:Workloads>
	<tns:Run >
		<tns:Declarations>
			<tns:Declare name="userId">184801</tns:Declare>
			<tns:Declare name="groupId"></tns:Declare>
			<tns:Declare name="companyId"></tns:Declare>
			<tns:Declare name="eventId"></tns:Declare></tns:Declarations>
		<tns:WorkloadReference name="getCredentials" /><tns:WorkloadReference
			name="addEventInCalendar" /></tns:Run>
</tns:FunctionalTest>
